system number	system name	functional unit name	organism	model_GF	context_GF	partition	completeness	strict	split	extended
7	SusCD_model	PUL	GCA_000436435.1, GCA_000699685.1, GCA_003435255.1, GCA_003463715.1, GCA_003463955.1, GCA_003472925.1, GCA_003474465.1, GCA_003526655.1, GCA_003602825.1, GCA_008679815.1, GCA_014871305.1, GCA_018366415.1, GCA_018375685.1, GCA_019012785.1, GCA_020809995.1, GCA_021204065.1, GCA_022713285.1, GCA_022713605.1, GCA_022714265.1, GCA_022718855.1, GCA_022719445.1, GCA_022719975.1, GCA_022720885.1, GCA_022728335.1, GCA_022734955.1, GCA_022739415.1, GCA_022740725.1, GCA_022742145.1, GCA_022742685.1, GCA_022745185.1, GCA_022747525.1, GCA_023418155.1, GCA_023634045.1, GCA_024758065.1, GCA_024758285.1, GCA_024758985.1, GCA_024759365.1, GCA_024759545.1, GCA_024787785.1, GCA_024788605.1, GCA_024788745.1, GCA_024788905.1, GCA_024789005.1, GCA_024789185.1, GCA_024789885.1, GCA_024790065.1, GCA_024790715.1, GCA_024790825.1, GCA_024791005.1, GCA_024791665.1, GCA_024792505.1, GCA_024792605.1, GCA_024793385.1, GCA_025757525.1, GCA_026719665.1, GCA_030839335.1, GCA_030839605.1, GCA_034121055.1, GCA_034121585.1, GCA_034121625.1, GCA_034123215.1, GCA_034123825.1, GCA_034124265.1, GCA_034125525.1, GCA_034125545.1, GCA_034125765.1, GCA_034126215.1, GCA_034126495.1, GCA_034127615.1, GCA_034128185.1, GCA_034128225.1, GCA_034129045.1, GCA_034129345.1, GCA_034129985.1, GCA_034130025.1, GCA_034130525.1, GCA_034131605.1, GCA_034132245.1, GCA_034133165.1, GCA_034133845.1, GCA_034134105.1, GCA_034134285.1, GCA_034135265.1, GCA_034135645.1, GCA_034136445.1, GCA_034136625.1, GCA_034137185.1, GCA_034139455.1, GCA_034139945.1, GCA_034142365.1, GCA_034143745.1, GCA_034144425.1, GCA_034144515.1, GCA_034145085.1, GCA_034146805.1, GCA_034146825.1, GCA_034149225.1, GCA_034149965.1, GCA_034150365.1, GCA_036740035.1, GCA_036776035.1, GCA_036801705.1, GCA_037239315.1, GCA_037247585.1, GCA_037253045.1, GCA_037265845.1, GCA_037298135.1, GCA_037317815.1, GCA_037337685.1, GCA_037341925.1, GCA_037347725.1, GCA_037454795.1, GCA_037456695.1, GCA_041326235.1, GCA_041330365.1, GCA_041331075.1, GCA_041334485.1, GCA_905205635.1, GCA_934667605.1, GCA_934667945.1, GCA_947071215.1, GCA_947507385.1, GCA_947645435.1, GCA_947645695.1, GCA_948907025.1, GCA_948937115.1, GCA_948947275.1, GCA_949014695.1, GCA_949015225.1, GCA_949024505.1, GCA_949030765.1, GCA_949042425.1, GCA_949052595.1, GCA_949052725.1, GCA_949053485.1, GCA_949091005.1, GCA_958349835.1, GCA_958426075.1, GCA_958434115.1, GCA_958435875.1, GCA_958437945.1, GCA_958442105.1, GCA_958442715.1, GCA_958444565.1, GCA_958450655.1, GCA_958455045.1, GCA_959020185.1, GCA_959021255.1, GCA_959025385.1, GCA_959605815.1, GCA_963560205.1, GCA_963586305.1, GCA_963928935.1, GCA_964239695.1, GCA_964241145.1, GCF_000157055.1, GCF_000162555.1, GCF_000178275.1, GCF_000218325.1, GCF_000273215.1, GCF_000699665.1, GCF_000699725.1, GCF_001578575.1, GCF_001815255.1, GCF_003363235.1, GCF_003435205.1, GCF_003439865.1, GCF_003458305.1, GCF_003458905.1, GCF_003459105.1, GCF_003463495.1, GCF_003465275.1, GCF_003465715.1, GCF_003465985.1, GCF_003466305.1, GCF_003468695.1, GCF_003470645.1, GCF_003472085.1, GCF_003472145.1, GCF_003472965.1, GCF_003612665.1, GCF_004167785.1, GCF_005844935.1, GCF_005844955.1, GCF_005844965.1, GCF_007012325.1, GCF_009734165.1, GCF_013361135.1, GCF_013361245.1, GCF_015547195.1, GCF_015547705.1, GCF_015548325.1, GCF_015548845.1, GCF_015549745.1, GCF_015550085.1, GCF_015550105.1, GCF_015551835.1, GCF_015552185.1, GCF_015552295.1, GCF_015554165.1, GCF_015554355.1, GCF_015554685.1, GCF_015555955.1, GCF_015557705.1, GCF_015557725.1, GCF_015558455.1, GCF_015558885.1, GCF_015559545.1, GCF_015561385.1, GCF_015670595.1, GCF_015831795.1, GCF_015831805.1, GCF_018292045.1, GCF_018368495.1, GCF_018377515.1, GCF_018492845.1, GCF_018785965.1, GCF_019126275.1, GCF_019412505.1, GCF_019412895.1, GCF_019418975.1, GCF_019424485.1, GCF_019733535.1, GCF_020091525.1, GCF_020256525.1, GCF_020256645.1, GCF_020256685.1, GCF_021406465.1, GCF_021406525.1, GCF_021409885.1, GCF_021410305.1, GCF_021410325.1, GCF_021410345.1, GCF_021410365.1, GCF_021410535.1, GCF_021410685.1, GCF_021411645.1, GCF_021411705.1, GCF_022713925.1, GCF_022740515.1, GCF_023668165.1, GCF_023668595.1, GCF_023668825.1, GCF_023668845.1, GCF_023668865.1, GCF_023668975.1, GCF_023669225.1, GCF_023669265.1, GCF_023669425.1, GCF_024759225.1, GCF_024759245.1, GCF_024759765.1, GCF_024759785.1, GCF_024787905.1, GCF_024788335.1, GCF_024788845.1, GCF_024789695.1, GCF_024791485.1, GCF_024793185.1, GCF_027257075.1, GCF_027668645.1, GCF_027669195.1, GCF_027681435.1, GCF_027681885.1, GCF_027681935.1, GCF_027682005.1, GCF_027683415.1, GCF_027688215.1, GCF_027690055.1, GCF_027692575.1, GCF_027693165.1, GCF_027694505.1, GCF_027694825.1, GCF_027717145.1, GCF_027722745.1, GCF_028399725.1, GCF_028399745.1, GCF_028399775.1, GCF_028399885.1, GCF_028399965.1, GCF_028400005.1, GCF_028400145.1, GCF_028400165.1, GCF_028400175.1, GCF_028400185.1, GCF_028400195.1, GCF_028400245.1, GCF_028400265.1, GCF_028400285.1, GCF_028400295.1, GCF_028400325.1, GCF_028400335.1, GCF_028400365.1, GCF_028400385.1, GCF_028400405.1, GCF_028400425.1, GCF_028400445.1, GCF_028400465.1, GCF_028400485.1, GCF_028400495.1, GCF_028400765.1, GCF_028400775.1, GCF_028400845.1, GCF_028400945.1, GCF_028400985.1, GCF_028400995.1, GCF_028401025.1, GCF_028401045.1, GCF_028401065.1, GCF_028401085.1, GCF_028401105.1, GCF_028401115.1, GCF_028401145.1, GCF_028401165.1, GCF_028401185.1, GCF_028401205.1, GCF_028401225.1, GCF_028401245.1, GCF_028401285.1, GCF_028401315.1, GCF_028401365.1, GCF_028402285.1, GCF_028402305.1, GCF_028402315.1, GCF_028402345.1, GCF_028402365.1, GCF_028402385.1, GCF_028402425.1, GCF_028561695.1, GCF_030168555.1, GCF_030928685.1, GCF_032476575.1, GCF_032490535.1, GCF_033099935.1, GCF_033550045.1, GCF_038561945.1, GCF_039064685.1, GCF_039064735.1, GCF_039064765.1, GCF_039064855.1, GCF_039733885.1, GCF_039755455.1, GCF_039755465.1, GCF_039755515.1, GCF_039755535.1, GCF_039755575.1, GCF_039755595.1, GCF_039755615.1, GCF_039755635.1, GCF_039755675.1, GCF_039761315.1, GCF_039761335.1, GCF_039761355.1, GCF_039761395.1, GCF_039761415.1, GCF_040091975.1, GCF_040092585.1, GCF_040092815.1, GCF_040095275.1, GCF_040097645.1, GCF_040227175.1, GCF_040227735.1, GCF_040227755.1, GCF_040227775.1, GCF_040227795.1, GCF_040227815.1, GCF_040227835.1, GCF_040227855.1, GCF_040227875.1, GCF_040227895.1, GCF_040227915.1, GCF_040227935.1, GCF_040227955.1, GCF_040227975.1, GCF_040227995.1, GCF_040913165.1, GCF_040913185.1, GCF_040913205.1, GCF_040913225.1, GCF_901212435.1, GCF_902374415.1, GCF_918258265.1, GCF_918270795.1, GCF_918271665.1, GCF_918291015.1, GCF_918291425.1, GCF_918291855.1, GCF_918297905.1, GCF_934699005.1, GCF_964237905.1, GCF_964238235.1, GCF_964238545.1, GCF_964239655.1, GCF_964239895.1, GCF_964239925.1, GCF_964240805.1, GCF_964241195.1, GCF_964243855.1, GCF_964244415.1, GCF_964260535.1	GCA_000273195.1_CDS_6227, GCA_000273195.1_CDS_6229, GCA_000273195.1_CDS_6233, GCA_000273195.1_CDS_6236, GCA_000436435.1_CDS_3868, GCA_000699685.1_CDS_4941, GCA_000699685.1_CDS_4948, GCA_003472925.1_CDS_3298, GCA_008679815.1_CDS_0958, GCA_022719975.1_CDS_2793, GCA_024758985.1_CDS_0281, GCA_024788605.1_CDS_0583, GCA_024788605.1_CDS_0603, GCA_024791005.1_CDS_0402, GCA_026719665.1_CDS_2258	GCA_000273195.1_CDS_6226, GCA_000273195.1_CDS_6231, GCA_000273195.1_CDS_6232, GCA_000273195.1_CDS_6234, GCA_000436435.1_CDS_3864, GCA_000436435.1_CDS_3873, GCA_003472925.1_CDS_3276, GCA_003472925.1_CDS_3297, GCA_024788605.1_CDS_0584, GCA_024788605.1_CDS_0602, GCF_040092815.1_CDS_4601	persistent|accessory	0.6494230769230769	1759	6499	0
8	SusCD_model	PUL	GCA_000699685.1, GCA_003463715.1, GCA_003472925.1, GCA_008679815.1, GCA_014871305.1, GCA_018366415.1, GCA_019012785.1, GCA_020809995.1, GCA_022718855.1, GCA_022719445.1, GCA_023634045.1, GCA_024758285.1, GCA_024758985.1, GCA_024790065.1, GCA_024792825.1, GCA_025757525.1, GCA_034121585.1, GCA_034121625.1, GCA_034123215.1, GCA_034123825.1, GCA_034124265.1, GCA_034125525.1, GCA_034125765.1, GCA_034126215.1, GCA_034126495.1, GCA_034128185.1, GCA_034129045.1, GCA_034129345.1, GCA_034129985.1, GCA_034130025.1, GCA_034130525.1, GCA_034131605.1, GCA_034132165.1, GCA_034132245.1, GCA_034133165.1, GCA_034134105.1, GCA_034135265.1, GCA_034135645.1, GCA_034136625.1, GCA_034137185.1, GCA_034138525.1, GCA_034139945.1, GCA_034142365.1, GCA_034144425.1, GCA_034144515.1, GCA_034146805.1, GCA_034146825.1, GCA_034149225.1, GCA_034150365.1, GCA_034152865.1, GCA_036740035.1, GCA_037247585.1, GCA_037265845.1, GCA_037337685.1, GCA_037338475.1, GCA_037347725.1, GCA_037435785.1, GCA_037437105.1, GCA_041326235.1, GCA_041330365.1, GCA_041334485.1, GCA_934667945.1, GCA_947507385.1, GCA_947645435.1, GCA_947645695.1, GCA_948907025.1, GCA_948937115.1, GCA_948947275.1, GCA_949014695.1, GCA_949015225.1, GCA_949024505.1, GCA_949030765.1, GCA_949042425.1, GCA_949052595.1, GCA_949052725.1, GCA_949053485.1, GCA_949091005.1, GCA_958426075.1, GCA_958434115.1, GCA_958435875.1, GCA_959025385.1, GCA_963560205.1, GCA_964239695.1, GCA_964241145.1, GCF_000162555.1, GCF_000218325.1, GCF_000273215.1, GCF_000699665.1, GCF_000699725.1, GCF_001578575.1, GCF_003458305.1, GCF_003458905.1, GCF_003459105.1, GCF_003459425.1, GCF_003463495.1, GCF_003465275.1, GCF_003466305.1, GCF_003472085.1, GCF_003472145.1, GCF_003472965.1, GCF_003604005.1, GCF_004167785.1, GCF_005844935.1, GCF_005844955.1, GCF_005844965.1, GCF_007012325.1, GCF_009734165.1, GCF_015547195.1, GCF_015548325.1, GCF_015548845.1, GCF_015549745.1, GCF_015550105.1, GCF_015557705.1, GCF_015557725.1, GCF_015559545.1, GCF_015561385.1, GCF_018368495.1, GCF_018492845.1, GCF_019418975.1, GCF_019424485.1, GCF_021406525.1, GCF_021410535.1, GCF_021411085.1, GCF_021411645.1, GCF_021411705.1, GCF_023668165.1, GCF_023668595.1, GCF_023668825.1, GCF_023668845.1, GCF_023668865.1, GCF_023668975.1, GCF_023669225.1, GCF_023669265.1, GCF_023669425.1, GCF_024791485.1, GCF_025914115.1, GCF_027660585.1, GCF_027661525.1, GCF_027661545.1, GCF_027661565.1, GCF_027661595.1, GCF_027668645.1, GCF_027669195.1, GCF_027681885.1, GCF_027682005.1, GCF_027690055.1, GCF_028399725.1, GCF_028399775.1, GCF_028399965.1, GCF_028400005.1, GCF_028400175.1, GCF_028400265.1, GCF_028400285.1, GCF_028400295.1, GCF_028400335.1, GCF_028400365.1, GCF_028400385.1, GCF_028400405.1, GCF_028400425.1, GCF_028400445.1, GCF_028400465.1, GCF_028400485.1, GCF_028400495.1, GCF_028400765.1, GCF_028400775.1, GCF_028400945.1, GCF_028401205.1, GCF_028401225.1, GCF_028401245.1, GCF_028401315.1, GCF_028401365.1, GCF_028402285.1, GCF_028402305.1, GCF_028402315.1, GCF_028402345.1, GCF_028402365.1, GCF_028402385.1, GCF_028402425.1, GCF_039755635.1, GCF_039755675.1, GCF_040091975.1, GCF_040092585.1, GCF_040227175.1, GCF_040227735.1, GCF_040227755.1, GCF_040227775.1, GCF_040227795.1, GCF_040227815.1, GCF_040227835.1, GCF_040227855.1, GCF_901212435.1, GCF_902374415.1, GCF_918291015.1, GCF_918291425.1, GCF_918291855.1, GCF_964237905.1, GCF_964238235.1, GCF_964238545.1, GCF_964243855.1, GCF_964244415.1, GCF_964260535.1	GCA_000273195.1_CDS_4199, GCA_000273195.1_CDS_4200, GCA_000273195.1_CDS_4202, GCA_000273195.1_CDS_4217, GCA_000273195.1_CDS_4218, GCA_000273195.1_CDS_4221, GCA_000273195.1_CDS_4223, GCA_000699685.1_CDS_0373, GCA_000699685.1_CDS_0374, GCA_000699685.1_CDS_0375, GCA_034149965.1_CDS_2170, GCF_019424485.1_CDS_3829, GCF_023668975.1_CDS_4392, GCF_040227175.1_CDS_0492	GCA_000273195.1_CDS_4201, GCA_000273195.1_CDS_4203, GCA_000273195.1_CDS_4220, GCA_000273195.1_CDS_4224, GCA_000436435.1_CDS_1320, GCA_000699685.1_CDS_0376, GCA_000699685.1_CDS_0378, GCA_022719975.1_CDS_0718, GCA_034130525.1_CDS_0141, GCA_947645435.1_CDS_2018, GCF_018377515.1_CDS_0516	persistent|accessory	0.9116417910447762	2407	2220	0
9	SusCD_model	PUL	GCA_000436435.1, GCA_003463955.1, GCA_003602825.1, GCA_022719975.1, GCA_022728335.1, GCA_022734955.1, GCA_022742145.1, GCA_022745185.1, GCA_022747525.1, GCA_024759365.1, GCA_024787785.1, GCA_024788605.1, GCA_024788745.1, GCA_024788905.1, GCA_024789005.1, GCA_024790715.1, GCA_024791005.1, GCA_024791665.1, GCA_024792605.1, GCA_026719665.1, GCA_030839605.1, GCA_034121055.1, GCA_034127615.1, GCA_034128225.1, GCA_034136445.1, GCA_034143745.1, GCA_034145085.1, GCA_036801705.1, GCA_037323035.1, GCA_037430025.1, GCA_037454795.1, GCA_037456695.1, GCA_041331075.1, GCA_905205635.1, GCA_947071215.1, GCA_958444565.1, GCA_958450655.1, GCA_959020185.1, GCA_959021255.1, GCA_959605815.1, GCF_000157055.1, GCF_000178275.1, GCF_003468695.1, GCF_015550085.1, GCF_015551835.1, GCF_015552185.1, GCF_015554355.1, GCF_015555955.1, GCF_015558885.1, GCF_015670595.1, GCF_018785965.1, GCF_019126275.1, GCF_019128845.1, GCF_019128915.1, GCF_019129155.2, GCF_019129255.1, GCF_019129405.1, GCF_019412505.1, GCF_020091525.1, GCF_020256525.1, GCF_020256645.1, GCF_020256685.1, GCF_021406465.1, GCF_021410685.1, GCF_024759225.1, GCF_024759245.1, GCF_024787905.1, GCF_024788845.1, GCF_024789695.1, GCF_024793185.1, GCF_027257075.1, GCF_027692575.1, GCF_027717145.1, GCF_027722745.1, GCF_028399745.1, GCF_028399885.1, GCF_028400325.1, GCF_028400845.1, GCF_028400985.1, GCF_028400995.1, GCF_028401025.1, GCF_028401045.1, GCF_028401285.1, GCF_028401345.1, GCF_028402175.1, GCF_028528005.1, GCF_030168555.1, GCF_030928685.1, GCF_032476575.1, GCF_039064685.1, GCF_039064735.1, GCF_039064765.1, GCF_039064855.1, GCF_039733885.1, GCF_039755535.1, GCF_039755595.1, GCF_039755615.1, GCF_934699005.1, GCF_964239895.1, GCF_964239925.1, GCF_964240805.1, GCF_964241195.1	GCA_000273195.1_CDS_4199, GCA_000273195.1_CDS_4200, GCA_000273195.1_CDS_4202, GCA_000273195.1_CDS_4217, GCA_000273195.1_CDS_4218, GCA_000273195.1_CDS_4221, GCA_000273195.1_CDS_4223, GCA_000436435.1_CDS_1312, GCA_000436435.1_CDS_1314, GCA_000436435.1_CDS_1315, GCA_000436435.1_CDS_1316, GCA_000436435.1_CDS_1317, GCA_034149965.1_CDS_2170, GCF_019424485.1_CDS_3829	GCA_000273195.1_CDS_4201, GCA_000273195.1_CDS_4203, GCA_000273195.1_CDS_4220, GCA_000273195.1_CDS_4224, GCA_000436435.1_CDS_1310, GCA_000436435.1_CDS_1313, GCA_000436435.1_CDS_1320, GCA_003463955.1_CDS_2079, GCA_022719975.1_CDS_0718, GCA_034130525.1_CDS_0141, GCA_947645435.1_CDS_2018	persistent|accessory	0.7811764705882354	182	1882	0
10	SusCD_model	PUL	GCA_034126185.1, GCA_034139455.1, GCF_039755435.1, GCF_039755495.1, GCF_039761415.1, GCF_918277415.1, GCF_964260215.1	GCA_000273195.1_CDS_4199, GCA_000273195.1_CDS_4200, GCA_000273195.1_CDS_4202, GCA_000273195.1_CDS_4216, GCA_000273195.1_CDS_4217, GCA_000273195.1_CDS_4218, GCA_000273195.1_CDS_4221, GCA_000273195.1_CDS_4223, GCA_034126185.1_CDS_1539, GCA_034126185.1_CDS_1540, GCA_034126185.1_CDS_1541, GCA_034126185.1_CDS_1543, GCA_034149965.1_CDS_2170, GCF_019424485.1_CDS_3829	GCA_000273195.1_CDS_4201, GCA_000273195.1_CDS_4203, GCA_000273195.1_CDS_4220, GCA_000273195.1_CDS_4224, GCA_000436435.1_CDS_1320, GCA_022719975.1_CDS_0718, GCA_034126185.1_CDS_1542, GCA_034126185.1_CDS_1544, GCA_034130525.1_CDS_0141, GCA_947645435.1_CDS_2018, GCF_018377515.1_CDS_0516	persistent|accessory	1.0	75	100	0
11	SusCD_model	PUL	GCA_000436435.1, GCA_000699685.1, GCA_003435255.1, GCA_003463715.1, GCA_003463955.1, GCA_003472925.1, GCA_003474465.1, GCA_003526655.1, GCA_003602825.1, GCA_008679815.1, GCA_014871305.1, GCA_018366415.1, GCA_018375685.1, GCA_019012785.1, GCA_020809995.1, GCA_021204065.1, GCA_022713285.1, GCA_022713605.1, GCA_022714265.1, GCA_022718855.1, GCA_022719445.1, GCA_022719975.1, GCA_022720885.1, GCA_022728335.1, GCA_022734955.1, GCA_022739415.1, GCA_022740725.1, GCA_022742145.1, GCA_022742685.1, GCA_022745185.1, GCA_022747525.1, GCA_023418155.1, GCA_023634045.1, GCA_024758065.1, GCA_024758285.1, GCA_024758985.1, GCA_024759365.1, GCA_024759545.1, GCA_024787785.1, GCA_024788605.1, GCA_024788745.1, GCA_024788905.1, GCA_024789005.1, GCA_024789185.1, GCA_024789885.1, GCA_024790065.1, GCA_024790715.1, GCA_024790825.1, GCA_024791005.1, GCA_024791665.1, GCA_024792505.1, GCA_024792605.1, GCA_024793385.1, GCA_025757525.1, GCA_026719665.1, GCA_030839335.1, GCA_030839605.1, GCA_034121055.1, GCA_034121585.1, GCA_034121625.1, GCA_034123215.1, GCA_034123825.1, GCA_034124265.1, GCA_034125525.1, GCA_034125545.1, GCA_034125765.1, GCA_034126215.1, GCA_034126495.1, GCA_034127615.1, GCA_034128185.1, GCA_034128225.1, GCA_034129045.1, GCA_034129345.1, GCA_034129985.1, GCA_034130025.1, GCA_034130525.1, GCA_034131605.1, GCA_034132245.1, GCA_034133165.1, GCA_034133845.1, GCA_034134105.1, GCA_034134285.1, GCA_034135265.1, GCA_034135645.1, GCA_034136445.1, GCA_034136625.1, GCA_034137185.1, GCA_034139455.1, GCA_034139945.1, GCA_034142365.1, GCA_034143745.1, GCA_034144425.1, GCA_034144515.1, GCA_034145085.1, GCA_034146805.1, GCA_034146825.1, GCA_034149225.1, GCA_034149965.1, GCA_034150365.1, GCA_036740035.1, GCA_036776035.1, GCA_036801705.1, GCA_037239315.1, GCA_037247585.1, GCA_037253045.1, GCA_037265845.1, GCA_037298135.1, GCA_037317815.1, GCA_037337685.1, GCA_037341925.1, GCA_037347725.1, GCA_037454795.1, GCA_037456695.1, GCA_041326235.1, GCA_041330365.1, GCA_041331075.1, GCA_041334485.1, GCA_905205635.1, GCA_934667605.1, GCA_934667945.1, GCA_947071215.1, GCA_947507385.1, GCA_947645435.1, GCA_947645695.1, GCA_948907025.1, GCA_948937115.1, GCA_948947275.1, GCA_949014695.1, GCA_949015225.1, GCA_949024505.1, GCA_949030765.1, GCA_949042425.1, GCA_949052595.1, GCA_949052725.1, GCA_949053485.1, GCA_949091005.1, GCA_958349835.1, GCA_958426075.1, GCA_958434115.1, GCA_958435875.1, GCA_958437945.1, GCA_958442105.1, GCA_958442715.1, GCA_958444565.1, GCA_958450655.1, GCA_958455045.1, GCA_959020185.1, GCA_959021255.1, GCA_959025385.1, GCA_959605815.1, GCA_963560205.1, GCA_963586305.1, GCA_963928935.1, GCA_964239695.1, GCA_964241145.1, GCF_000157055.1, GCF_000162555.1, GCF_000178275.1, GCF_000218325.1, GCF_000273215.1, GCF_000699665.1, GCF_000699725.1, GCF_001578575.1, GCF_001815255.1, GCF_003363235.1, GCF_003435205.1, GCF_003439865.1, GCF_003458305.1, GCF_003458905.1, GCF_003459105.1, GCF_003463495.1, GCF_003465275.1, GCF_003465715.1, GCF_003465985.1, GCF_003466305.1, GCF_003468695.1, GCF_003470645.1, GCF_003472085.1, GCF_003472145.1, GCF_003472965.1, GCF_003612665.1, GCF_004167785.1, GCF_005844935.1, GCF_005844955.1, GCF_005844965.1, GCF_007012325.1, GCF_009734165.1, GCF_013361135.1, GCF_013361245.1, GCF_015547195.1, GCF_015547705.1, GCF_015548325.1, GCF_015548845.1, GCF_015549745.1, GCF_015550085.1, GCF_015550105.1, GCF_015551835.1, GCF_015552185.1, GCF_015552295.1, GCF_015554165.1, GCF_015554355.1, GCF_015554685.1, GCF_015555955.1, GCF_015557705.1, GCF_015557725.1, GCF_015558455.1, GCF_015558885.1, GCF_015559545.1, GCF_015561385.1, GCF_015670595.1, GCF_015831795.1, GCF_015831805.1, GCF_018292045.1, GCF_018368495.1, GCF_018377515.1, GCF_018492845.1, GCF_018785965.1, GCF_019126275.1, GCF_019412505.1, GCF_019412895.1, GCF_019418975.1, GCF_019424485.1, GCF_019733535.1, GCF_020091525.1, GCF_020256525.1, GCF_020256645.1, GCF_020256685.1, GCF_021406465.1, GCF_021406525.1, GCF_021409885.1, GCF_021410305.1, GCF_021410325.1, GCF_021410345.1, GCF_021410365.1, GCF_021410535.1, GCF_021410685.1, GCF_021411645.1, GCF_021411705.1, GCF_022713925.1, GCF_022740515.1, GCF_023668165.1, GCF_023668595.1, GCF_023668825.1, GCF_023668845.1, GCF_023668865.1, GCF_023668975.1, GCF_023669225.1, GCF_023669265.1, GCF_023669425.1, GCF_024759225.1, GCF_024759245.1, GCF_024759765.1, GCF_024759785.1, GCF_024787905.1, GCF_024788335.1, GCF_024788845.1, GCF_024789695.1, GCF_024791485.1, GCF_024793185.1, GCF_027257075.1, GCF_027668645.1, GCF_027669195.1, GCF_027681435.1, GCF_027681885.1, GCF_027681935.1, GCF_027682005.1, GCF_027683415.1, GCF_027688215.1, GCF_027690055.1, GCF_027692575.1, GCF_027693165.1, GCF_027694505.1, GCF_027694825.1, GCF_027717145.1, GCF_027722745.1, GCF_028399725.1, GCF_028399745.1, GCF_028399775.1, GCF_028399885.1, GCF_028399965.1, GCF_028400005.1, GCF_028400145.1, GCF_028400165.1, GCF_028400175.1, GCF_028400185.1, GCF_028400195.1, GCF_028400245.1, GCF_028400265.1, GCF_028400285.1, GCF_028400295.1, GCF_028400325.1, GCF_028400335.1, GCF_028400365.1, GCF_028400385.1, GCF_028400405.1, GCF_028400425.1, GCF_028400445.1, GCF_028400465.1, GCF_028400485.1, GCF_028400495.1, GCF_028400765.1, GCF_028400775.1, GCF_028400845.1, GCF_028400945.1, GCF_028400985.1, GCF_028400995.1, GCF_028401025.1, GCF_028401045.1, GCF_028401065.1, GCF_028401085.1, GCF_028401105.1, GCF_028401115.1, GCF_028401145.1, GCF_028401165.1, GCF_028401185.1, GCF_028401205.1, GCF_028401225.1, GCF_028401245.1, GCF_028401285.1, GCF_028401315.1, GCF_028401365.1, GCF_028402285.1, GCF_028402305.1, GCF_028402315.1, GCF_028402345.1, GCF_028402365.1, GCF_028402385.1, GCF_028402425.1, GCF_028561695.1, GCF_030168555.1, GCF_030928685.1, GCF_032476575.1, GCF_032490535.1, GCF_033099935.1, GCF_033550045.1, GCF_038561945.1, GCF_039064685.1, GCF_039064735.1, GCF_039064765.1, GCF_039064855.1, GCF_039733885.1, GCF_039755455.1, GCF_039755465.1, GCF_039755515.1, GCF_039755535.1, GCF_039755575.1, GCF_039755595.1, GCF_039755615.1, GCF_039755635.1, GCF_039755675.1, GCF_039761315.1, GCF_039761335.1, GCF_039761355.1, GCF_039761395.1, GCF_039761415.1, GCF_040091975.1, GCF_040092585.1, GCF_040092815.1, GCF_040095275.1, GCF_040097645.1, GCF_040227175.1, GCF_040227735.1, GCF_040227755.1, GCF_040227775.1, GCF_040227795.1, GCF_040227815.1, GCF_040227835.1, GCF_040227855.1, GCF_040227875.1, GCF_040227895.1, GCF_040227915.1, GCF_040227935.1, GCF_040227955.1, GCF_040227975.1, GCF_040227995.1, GCF_040913165.1, GCF_040913185.1, GCF_040913205.1, GCF_040913225.1, GCF_901212435.1, GCF_902374415.1, GCF_918258265.1, GCF_918270795.1, GCF_918271665.1, GCF_918291015.1, GCF_918291425.1, GCF_918291855.1, GCF_918297905.1, GCF_934699005.1, GCF_964237905.1, GCF_964238235.1, GCF_964238545.1, GCF_964239655.1, GCF_964239895.1, GCF_964239925.1, GCF_964240805.1, GCF_964241195.1, GCF_964243855.1, GCF_964244415.1, GCF_964260535.1	GCA_000273195.1_CDS_2135, GCA_000273195.1_CDS_2137, GCA_000273195.1_CDS_6227, GCA_000273195.1_CDS_6229, GCA_000273195.1_CDS_6233, GCA_000273195.1_CDS_6236, GCA_000436435.1_CDS_3868, GCA_000699685.1_CDS_4941, GCA_000699685.1_CDS_4948, GCA_008679815.1_CDS_0958, GCA_022719975.1_CDS_2793, GCA_024758985.1_CDS_0281, GCA_024791005.1_CDS_0402, GCA_026719665.1_CDS_2258	GCA_000273195.1_CDS_1943, GCA_000273195.1_CDS_2134, GCA_000273195.1_CDS_2136, GCA_000273195.1_CDS_6226, GCA_000273195.1_CDS_6231, GCA_000273195.1_CDS_6232, GCA_000273195.1_CDS_6234, GCA_000436435.1_CDS_3864, GCA_000436435.1_CDS_3873, GCF_040092815.1_CDS_4601	persistent|accessory	0.6975	1905	6223	0
