system number	system name	functional unit name	organism	model_GF	context_GF	partition	completeness	strict	split	extended
33	SusCD_model	PUL	GCA_000273195.1, GCA_003435255.1, GCA_003474465.1, GCA_003526655.1, GCA_018375685.1, GCA_019013265.1, GCA_021204065.1, GCA_022713285.1, GCA_022713605.1, GCA_022714265.1, GCA_022716205.1, GCA_022720885.1, GCA_022728795.1, GCA_022739415.1, GCA_022740725.1, GCA_022742685.1, GCA_022745185.1, GCA_023390895.1, GCA_023418155.1, GCA_024758065.1, GCA_024759545.1, GCA_024789165.1, GCA_024789185.1, GCA_024789885.1, GCA_024790825.1, GCA_024792505.1, GCA_024792765.1, GCA_024793385.1, GCA_030839335.1, GCA_034125545.1, GCA_034133625.1, GCA_034133845.1, GCA_034134285.1, GCA_034141585.1, GCA_034144245.1, GCA_034145525.1, GCA_034149965.1, GCA_036776035.1, GCA_037239315.1, GCA_037253045.1, GCA_037341925.1, GCA_934667605.1, GCA_934699115.1, GCA_947647305.1, GCA_949417435.1, GCA_958349835.1, GCA_958437945.1, GCA_958442105.1, GCA_958442715.1, GCA_958448935.1, GCA_958455045.1, GCA_963586305.1, GCA_963928935.1, GCF_000154125.1, GCF_001314995.1, GCF_001535615.1, GCF_001815255.1, GCF_002959635.1, GCF_003363235.1, GCF_003435205.1, GCF_003439865.1, GCF_003465715.1, GCF_003465985.1, GCF_003470645.1, GCF_003612665.1, GCF_005844755.1, GCF_005844865.1, GCF_005844885.1, GCF_005844905.1, GCF_005845145.1, GCF_005845305.1, GCF_007341375.1, GCF_007341395.1, GCF_013361135.1, GCF_013361245.1, GCF_015547705.1, GCF_015548155.1, GCF_015549705.1, GCF_015550025.1, GCF_015552205.1, GCF_015552295.1, GCF_015554165.1, GCF_015554685.1, GCF_015555775.1, GCF_015556825.1, GCF_015557585.1, GCF_015558455.1, GCF_015831795.1, GCF_015831805.1, GCF_016894185.1, GCF_018292045.1, GCF_018377515.1, GCF_018785975.1, GCF_019129455.1, GCF_019412895.1, GCF_019733535.1, GCF_020149745.1, GCF_021409885.1, GCF_021410305.1, GCF_021410325.1, GCF_021410345.1, GCF_021410365.1, GCF_021410745.1, GCF_021411555.1, GCF_021589085.1, GCF_022713925.1, GCF_022716715.1, GCF_022740515.1, GCF_024759765.1, GCF_024759785.1, GCF_024788335.1, GCF_024788555.1, GCF_024791065.1, GCF_024792145.1, GCF_025146775.1, GCF_026966855.1, GCF_027681435.1, GCF_027681935.1, GCF_027683415.1, GCF_027688215.1, GCF_027693165.1, GCF_027694505.1, GCF_027694825.1, GCF_028399855.1, GCF_028399925.1, GCF_028399945.1, GCF_028399975.1, GCF_028400025.1, GCF_028400045.1, GCF_028400065.1, GCF_028400075.1, GCF_028400095.1, GCF_028400145.1, GCF_028400165.1, GCF_028400185.1, GCF_028400195.1, GCF_028400245.1, GCF_028400505.1, GCF_028400545.1, GCF_028400565.1, GCF_028400575.1, GCF_028400595.1, GCF_028400615.1, GCF_028400645.1, GCF_028400665.1, GCF_028400685.1, GCF_028400705.1, GCF_028400725.1, GCF_028400745.1, GCF_028400805.1, GCF_028400825.1, GCF_028401065.1, GCF_028401085.1, GCF_028401105.1, GCF_028401115.1, GCF_028401145.1, GCF_028401165.1, GCF_028401185.1, GCF_028401255.1, GCF_028401295.1, GCF_028561695.1, GCF_032144175.1, GCF_032490535.1, GCF_033099935.1, GCF_033550045.1, GCF_038561945.1, GCF_039755455.1, GCF_039755465.1, GCF_039755515.1, GCF_039755575.1, GCF_039761115.1, GCF_039761235.1, GCF_039761315.1, GCF_039761335.1, GCF_039761355.1, GCF_039761395.1, GCF_039761425.1, GCF_040092815.1, GCF_040095275.1, GCF_040097645.1, GCF_040227875.1, GCF_040227895.1, GCF_040227915.1, GCF_040227935.1, GCF_040227955.1, GCF_040227975.1, GCF_040227995.1, GCF_040913165.1, GCF_040913185.1, GCF_040913205.1, GCF_040913225.1, GCF_900095495.1, GCF_900107475.1, GCF_900445505.1, GCF_918258265.1, GCF_918271665.1, GCF_918279245.1, GCF_918297905.1, GCF_964239395.1, GCF_964239655.1, GCF_964246445.1	GCA_000273195.1_CDS_4211, GCA_000273195.1_CDS_4213, GCA_000273195.1_CDS_4216, GCA_000273195.1_CDS_4217, GCA_000273195.1_CDS_4218, GCA_024789885.1_CDS_2916, GCA_024789885.1_CDS_2923, GCF_022716715.1_CDS_2473	GCA_000273195.1_CDS_4212, GCA_000699685.1_CDS_0369, GCA_003474465.1_CDS_0149	persistent|accessory	0.7435549525101764	1930	104	0
34	SusCD_model	PUL	GCA_000436435.1, GCA_000699685.1, GCA_003435255.1, GCA_003463715.1, GCA_003463955.1, GCA_003472925.1, GCA_003474465.1, GCA_003526655.1, GCA_003602825.1, GCA_008679815.1, GCA_014871305.1, GCA_018366415.1, GCA_018375685.1, GCA_019012785.1, GCA_020809995.1, GCA_021204065.1, GCA_022713285.1, GCA_022713605.1, GCA_022714265.1, GCA_022718855.1, GCA_022719445.1, GCA_022719975.1, GCA_022720885.1, GCA_022728335.1, GCA_022734955.1, GCA_022739415.1, GCA_022740725.1, GCA_022742145.1, GCA_022742685.1, GCA_022745185.1, GCA_022747525.1, GCA_023418155.1, GCA_023634045.1, GCA_024758065.1, GCA_024758285.1, GCA_024758985.1, GCA_024759365.1, GCA_024759545.1, GCA_024787785.1, GCA_024788605.1, GCA_024788745.1, GCA_024788905.1, GCA_024789005.1, GCA_024789185.1, GCA_024789885.1, GCA_024790065.1, GCA_024790715.1, GCA_024790825.1, GCA_024791005.1, GCA_024791665.1, GCA_024792505.1, GCA_024792605.1, GCA_024793385.1, GCA_025757525.1, GCA_026719665.1, GCA_030839335.1, GCA_030839605.1, GCA_034121055.1, GCA_034121585.1, GCA_034121625.1, GCA_034123215.1, GCA_034123825.1, GCA_034124265.1, GCA_034125525.1, GCA_034125545.1, GCA_034125765.1, GCA_034126215.1, GCA_034126495.1, GCA_034127615.1, GCA_034128185.1, GCA_034128225.1, GCA_034129045.1, GCA_034129345.1, GCA_034129985.1, GCA_034130025.1, GCA_034130525.1, GCA_034131605.1, GCA_034132245.1, GCA_034133165.1, GCA_034133845.1, GCA_034134105.1, GCA_034134285.1, GCA_034135265.1, GCA_034135645.1, GCA_034136445.1, GCA_034136625.1, GCA_034137185.1, GCA_034139455.1, GCA_034139945.1, GCA_034142365.1, GCA_034143745.1, GCA_034144425.1, GCA_034144515.1, GCA_034145085.1, GCA_034146805.1, GCA_034146825.1, GCA_034149225.1, GCA_034149965.1, GCA_034150365.1, GCA_036740035.1, GCA_036776035.1, GCA_036801705.1, GCA_037247585.1, GCA_037253045.1, GCA_037265845.1, GCA_037298135.1, GCA_037317815.1, GCA_037337685.1, GCA_037341925.1, GCA_037347725.1, GCA_037454795.1, GCA_037456695.1, GCA_041326235.1, GCA_041330365.1, GCA_041331075.1, GCA_041334485.1, GCA_905205635.1, GCA_934667605.1, GCA_934667945.1, GCA_947071215.1, GCA_947507385.1, GCA_947645435.1, GCA_947645695.1, GCA_948907025.1, GCA_948937115.1, GCA_948947275.1, GCA_949014695.1, GCA_949015225.1, GCA_949024505.1, GCA_949030765.1, GCA_949042425.1, GCA_949052595.1, GCA_949052725.1, GCA_949053485.1, GCA_949091005.1, GCA_958349835.1, GCA_958434115.1, GCA_958435875.1, GCA_958437945.1, GCA_958442105.1, GCA_958442715.1, GCA_958444565.1, GCA_958450655.1, GCA_958455045.1, GCA_959020185.1, GCA_959021255.1, GCA_959025385.1, GCA_959605815.1, GCA_963560205.1, GCA_963586305.1, GCA_963928935.1, GCA_964239695.1, GCA_964241145.1, GCF_000157055.1, GCF_000162555.1, GCF_000178275.1, GCF_000218325.1, GCF_000273215.1, GCF_000699665.1, GCF_000699725.1, GCF_001578575.1, GCF_001815255.1, GCF_003363235.1, GCF_003435205.1, GCF_003439865.1, GCF_003458305.1, GCF_003458905.1, GCF_003459105.1, GCF_003463495.1, GCF_003465275.1, GCF_003465715.1, GCF_003465985.1, GCF_003466305.1, GCF_003468695.1, GCF_003470645.1, GCF_003472085.1, GCF_003472145.1, GCF_003472965.1, GCF_003612665.1, GCF_004167785.1, GCF_005844935.1, GCF_005844955.1, GCF_005844965.1, GCF_007012325.1, GCF_009734165.1, GCF_013361135.1, GCF_013361245.1, GCF_015547195.1, GCF_015547705.1, GCF_015548325.1, GCF_015548845.1, GCF_015549745.1, GCF_015550085.1, GCF_015550105.1, GCF_015551835.1, GCF_015552185.1, GCF_015552295.1, GCF_015554165.1, GCF_015554355.1, GCF_015554685.1, GCF_015555955.1, GCF_015557705.1, GCF_015557725.1, GCF_015558455.1, GCF_015558885.1, GCF_015559545.1, GCF_015561385.1, GCF_015670595.1, GCF_015831795.1, GCF_015831805.1, GCF_018292045.1, GCF_018368495.1, GCF_018377515.1, GCF_018492845.1, GCF_018785965.1, GCF_019126275.1, GCF_019412505.1, GCF_019412895.1, GCF_019418975.1, GCF_019424485.1, GCF_019733535.1, GCF_020091525.1, GCF_020256525.1, GCF_020256645.1, GCF_020256685.1, GCF_021406465.1, GCF_021406525.1, GCF_021409885.1, GCF_021410305.1, GCF_021410325.1, GCF_021410345.1, GCF_021410365.1, GCF_021410535.1, GCF_021410685.1, GCF_021411645.1, GCF_021411705.1, GCF_022713925.1, GCF_022740515.1, GCF_023668165.1, GCF_023668595.1, GCF_023668825.1, GCF_023668845.1, GCF_023668865.1, GCF_023668975.1, GCF_023669225.1, GCF_023669265.1, GCF_023669425.1, GCF_024759225.1, GCF_024759245.1, GCF_024759765.1, GCF_024759785.1, GCF_024787905.1, GCF_024788335.1, GCF_024788845.1, GCF_024789695.1, GCF_024791485.1, GCF_024793185.1, GCF_027257075.1, GCF_027668645.1, GCF_027669195.1, GCF_027681435.1, GCF_027681885.1, GCF_027681935.1, GCF_027682005.1, GCF_027683415.1, GCF_027688215.1, GCF_027690055.1, GCF_027692575.1, GCF_027693165.1, GCF_027694505.1, GCF_027694825.1, GCF_027717145.1, GCF_027722745.1, GCF_028399725.1, GCF_028399745.1, GCF_028399775.1, GCF_028399885.1, GCF_028399965.1, GCF_028400005.1, GCF_028400145.1, GCF_028400165.1, GCF_028400175.1, GCF_028400185.1, GCF_028400195.1, GCF_028400245.1, GCF_028400265.1, GCF_028400285.1, GCF_028400295.1, GCF_028400325.1, GCF_028400335.1, GCF_028400365.1, GCF_028400385.1, GCF_028400405.1, GCF_028400425.1, GCF_028400445.1, GCF_028400465.1, GCF_028400485.1, GCF_028400495.1, GCF_028400765.1, GCF_028400775.1, GCF_028400845.1, GCF_028400945.1, GCF_028400985.1, GCF_028400995.1, GCF_028401025.1, GCF_028401045.1, GCF_028401065.1, GCF_028401085.1, GCF_028401105.1, GCF_028401115.1, GCF_028401145.1, GCF_028401165.1, GCF_028401185.1, GCF_028401205.1, GCF_028401225.1, GCF_028401245.1, GCF_028401285.1, GCF_028401315.1, GCF_028401365.1, GCF_028402285.1, GCF_028402305.1, GCF_028402315.1, GCF_028402345.1, GCF_028402365.1, GCF_028402385.1, GCF_028402425.1, GCF_028561695.1, GCF_030168555.1, GCF_030928685.1, GCF_032476575.1, GCF_032490535.1, GCF_033099935.1, GCF_033550045.1, GCF_038561945.1, GCF_039064685.1, GCF_039064735.1, GCF_039064765.1, GCF_039064855.1, GCF_039733885.1, GCF_039755455.1, GCF_039755465.1, GCF_039755515.1, GCF_039755535.1, GCF_039755575.1, GCF_039755595.1, GCF_039755615.1, GCF_039755635.1, GCF_039755675.1, GCF_039761315.1, GCF_039761335.1, GCF_039761355.1, GCF_039761395.1, GCF_039761415.1, GCF_040091975.1, GCF_040092585.1, GCF_040092815.1, GCF_040095275.1, GCF_040097645.1, GCF_040227175.1, GCF_040227735.1, GCF_040227755.1, GCF_040227775.1, GCF_040227795.1, GCF_040227815.1, GCF_040227835.1, GCF_040227855.1, GCF_040227875.1, GCF_040227895.1, GCF_040227915.1, GCF_040227935.1, GCF_040227955.1, GCF_040227975.1, GCF_040227995.1, GCF_040913165.1, GCF_040913185.1, GCF_040913205.1, GCF_040913225.1, GCF_901212435.1, GCF_902374415.1, GCF_918258265.1, GCF_918270795.1, GCF_918271665.1, GCF_918291015.1, GCF_918291425.1, GCF_918291855.1, GCF_918297905.1, GCF_934699005.1, GCF_964237905.1, GCF_964238235.1, GCF_964238545.1, GCF_964239655.1, GCF_964239895.1, GCF_964239925.1, GCF_964240805.1, GCF_964241195.1, GCF_964243855.1, GCF_964244415.1, GCF_964260535.1	GCA_000273195.1_CDS_6233, GCA_000273195.1_CDS_6236, GCA_000436435.1_CDS_3868, GCA_000699685.1_CDS_4941, GCA_022719975.1_CDS_2793, GCA_024791005.1_CDS_0402, GCA_026719665.1_CDS_2258, GCF_015548845.1_CDS_3535	GCA_000273195.1_CDS_6231, GCA_000273195.1_CDS_6232, GCA_000273195.1_CDS_6234, GCA_000436435.1_CDS_3864, GCA_003463715.1_CDS_1994, GCA_023634045.1_CDS_1950, GCF_040092815.1_CDS_4601	persistent|accessory	0.7753768844221106	634	4855	0
35	SusCD_model	PUL	GCA_000273195.1, GCA_003463715.1, GCA_003472925.1, GCA_003474465.1, GCA_003526655.1, GCA_003602825.1, GCA_008679815.1, GCA_014871305.1, GCA_018366415.1, GCA_018375685.1, GCA_019012785.1, GCA_019013265.1, GCA_020809995.1, GCA_021204065.1, GCA_022714265.1, GCA_022720885.1, GCA_022728795.1, GCA_022739415.1, GCA_022740725.1, GCA_022742685.1, GCA_022745185.1, GCA_024787785.1, GCA_024789165.1, GCA_024790715.1, GCA_024792505.1, GCA_024792765.1, GCA_025757525.1, GCA_026719665.1, GCA_030839605.1, GCA_034121585.1, GCA_034121625.1, GCA_034123215.1, GCA_034123825.1, GCA_034124265.1, GCA_034125525.1, GCA_034125545.1, GCA_034125765.1, GCA_034126185.1, GCA_034126215.1, GCA_034126495.1, GCA_034128185.1, GCA_034129345.1, GCA_034129985.1, GCA_034130525.1, GCA_034131605.1, GCA_034133165.1, GCA_034133625.1, GCA_034133845.1, GCA_034134285.1, GCA_034135265.1, GCA_034135645.1, GCA_034136625.1, GCA_034137185.1, GCA_034139455.1, GCA_034141585.1, GCA_034142365.1, GCA_034144245.1, GCA_034144425.1, GCA_034144515.1, GCA_034145525.1, GCA_034146805.1, GCA_034146825.1, GCA_034149225.1, GCA_034149965.1, GCA_034150365.1, GCA_036740035.1, GCA_036776035.1, GCA_037247585.1, GCA_037253045.1, GCA_037265845.1, GCA_037319905.1, GCA_037323035.1, GCA_037337685.1, GCA_037341925.1, GCA_037435785.1, GCA_041330365.1, GCA_041331075.1, GCA_905205635.1, GCA_934667605.1, GCA_934699115.1, GCA_947507385.1, GCA_947645435.1, GCA_947645695.1, GCA_948907025.1, GCA_948937115.1, GCA_948947275.1, GCA_949014695.1, GCA_949015225.1, GCA_949024505.1, GCA_949030765.1, GCA_949042425.1, GCA_949052595.1, GCA_949052725.1, GCA_949053485.1, GCA_949091005.1, GCA_958435875.1, GCA_958437945.1, GCA_958442105.1, GCA_958442715.1, GCA_958448935.1, GCA_958450655.1, GCA_958455045.1, GCA_959025385.1, GCA_963560205.1, GCA_963586305.1, GCA_963928935.1, GCF_000157055.1, GCF_000162555.1, GCF_000273215.1, GCF_001535615.1, GCF_003363235.1, GCF_003458305.1, GCF_003458905.1, GCF_003459105.1, GCF_003459425.1, GCF_003463495.1, GCF_003465715.1, GCF_003465985.1, GCF_003466305.1, GCF_003470645.1, GCF_003472085.1, GCF_003472145.1, GCF_003472965.1, GCF_003612665.1, GCF_004167785.1, GCF_005844755.1, GCF_005844885.1, GCF_005844905.1, GCF_005844935.1, GCF_005845305.1, GCF_007341375.1, GCF_007341395.1, GCF_013361135.1, GCF_013361245.1, GCF_015547705.1, GCF_015548155.1, GCF_015548325.1, GCF_015549705.1, GCF_015550105.1, GCF_015552205.1, GCF_015552295.1, GCF_015554165.1, GCF_015557705.1, GCF_015558455.1, GCF_015559545.1, GCF_015831795.1, GCF_015831805.1, GCF_018377515.1, GCF_018492845.1, GCF_018785975.1, GCF_019126275.1, GCF_019128845.1, GCF_019128915.1, GCF_019129155.2, GCF_019129255.1, GCF_019129405.1, GCF_019129455.1, GCF_019412505.1, GCF_019412895.1, GCF_019418975.1, GCF_019424485.1, GCF_019733535.1, GCF_021406465.1, GCF_021406525.1, GCF_021409885.1, GCF_021410535.1, GCF_021411705.1, GCF_021589085.1, GCF_022713925.1, GCF_022716715.1, GCF_022740515.1, GCF_023668165.1, GCF_023668595.1, GCF_023668825.1, GCF_023668845.1, GCF_023668865.1, GCF_023668975.1, GCF_023669225.1, GCF_023669265.1, GCF_023669425.1, GCF_024788555.1, GCF_024791065.1, GCF_024791485.1, GCF_024792145.1, GCF_026966855.1, GCF_027660585.1, GCF_027661525.1, GCF_027661545.1, GCF_027661565.1, GCF_027661595.1, GCF_027681435.1, GCF_027681885.1, GCF_027681935.1, GCF_027682005.1, GCF_027688215.1, GCF_027693165.1, GCF_027694505.1, GCF_028399725.1, GCF_028399855.1, GCF_028399925.1, GCF_028399945.1, GCF_028399965.1, GCF_028399975.1, GCF_028400005.1, GCF_028400025.1, GCF_028400165.1, GCF_028400175.1, GCF_028400185.1, GCF_028400195.1, GCF_028400245.1, GCF_028400265.1, GCF_028400285.1, GCF_028400295.1, GCF_028400335.1, GCF_028400365.1, GCF_028400385.1, GCF_028400405.1, GCF_028400425.1, GCF_028400445.1, GCF_028400465.1, GCF_028400485.1, GCF_028400495.1, GCF_028400685.1, GCF_028400705.1, GCF_028400725.1, GCF_028400745.1, GCF_028400765.1, GCF_028400805.1, GCF_028401065.1, GCF_028401085.1, GCF_028401105.1, GCF_028401115.1, GCF_028401145.1, GCF_028401165.1, GCF_028401185.1, GCF_028401315.1, GCF_028401365.1, GCF_028402285.1, GCF_028402305.1, GCF_028402315.1, GCF_028402345.1, GCF_028402365.1, GCF_028402385.1, GCF_028402425.1, GCF_028561695.1, GCF_033099935.1, GCF_038561945.1, GCF_039755435.1, GCF_039755455.1, GCF_039755465.1, GCF_039755495.1, GCF_039755515.1, GCF_039755575.1, GCF_039761115.1, GCF_039761235.1, GCF_039761315.1, GCF_039761335.1, GCF_039761355.1, GCF_039761395.1, GCF_039761415.1, GCF_039761425.1, GCF_040091975.1, GCF_040092585.1, GCF_040092815.1, GCF_040095275.1, GCF_040097645.1, GCF_040227175.1, GCF_040227735.1, GCF_040227755.1, GCF_040227775.1, GCF_040227795.1, GCF_040227815.1, GCF_040227835.1, GCF_040227855.1, GCF_040227875.1, GCF_040227895.1, GCF_040227915.1, GCF_040227935.1, GCF_040227955.1, GCF_040227975.1, GCF_040227995.1, GCF_040913165.1, GCF_040913185.1, GCF_040913205.1, GCF_040913225.1, GCF_918258265.1, GCF_918271665.1, GCF_918277415.1, GCF_918291425.1, GCF_918291855.1, GCF_934699005.1, GCF_964237905.1, GCF_964238235.1, GCF_964238545.1, GCF_964239895.1, GCF_964240805.1, GCF_964246445.1, GCF_964260215.1	GCA_000273195.1_CDS_4268, GCA_000273195.1_CDS_4269, GCA_000436435.1_CDS_1661, GCA_000699685.1_CDS_0182, GCA_008679815.1_CDS_1963, GCA_022719975.1_CDS_2793, GCA_024787785.1_CDS_7014, GCF_028528005.1_CDS_3042	GCA_000273195.1_CDS_4264, GCA_000273195.1_CDS_4267, GCA_000436435.1_CDS_3864, GCA_024787785.1_CDS_2944, GCA_024790715.1_CDS_0860, GCF_003459105.1_CDS_2774, GCF_040092815.1_CDS_4601	persistent|accessory	0.714765100671141	20	4204	0
36	SusCD_model	PUL	GCA_000273195.1, GCA_000436435.1, GCA_000699685.1, GCA_003435255.1, GCA_003463715.1, GCA_003463955.1, GCA_003472925.1, GCA_003474465.1, GCA_003526655.1, GCA_003602825.1, GCA_008679815.1, GCA_014871305.1, GCA_018366415.1, GCA_018375685.1, GCA_019012785.1, GCA_019013265.1, GCA_020809995.1, GCA_022713605.1, GCA_022714265.1, GCA_022716205.1, GCA_022718855.1, GCA_022719445.1, GCA_022719975.1, GCA_022720885.1, GCA_022728335.1, GCA_022728795.1, GCA_022739415.1, GCA_022740725.1, GCA_022742145.1, GCA_022745185.1, GCA_022747525.1, GCA_023390895.1, GCA_023418155.1, GCA_023634045.1, GCA_024758065.1, GCA_024758285.1, GCA_024758985.1, GCA_024759365.1, GCA_024759545.1, GCA_024787785.1, GCA_024788605.1, GCA_024788745.1, GCA_024788905.1, GCA_024789005.1, GCA_024789165.1, GCA_024789185.1, GCA_024789885.1, GCA_024790065.1, GCA_024790715.1, GCA_024790825.1, GCA_024791005.1, GCA_024791665.1, GCA_024792505.1, GCA_024792605.1, GCA_024792765.1, GCA_024792825.1, GCA_024793385.1, GCA_025757525.1, GCA_026719665.1, GCA_030839335.1, GCA_030839605.1, GCA_034121055.1, GCA_034121585.1, GCA_034121625.1, GCA_034123215.1, GCA_034123825.1, GCA_034124265.1, GCA_034125525.1, GCA_034125545.1, GCA_034125765.1, GCA_034126185.1, GCA_034126495.1, GCA_034127615.1, GCA_034128185.1, GCA_034128225.1, GCA_034129045.1, GCA_034129345.1, GCA_034129985.1, GCA_034130025.1, GCA_034130525.1, GCA_034131605.1, GCA_034132165.1, GCA_034132245.1, GCA_034133165.1, GCA_034133625.1, GCA_034133845.1, GCA_034134105.1, GCA_034134285.1, GCA_034135265.1, GCA_034135645.1, GCA_034136445.1, GCA_034136625.1, GCA_034137185.1, GCA_034138525.1, GCA_034139455.1, GCA_034139945.1, GCA_034141585.1, GCA_034142365.1, GCA_034143745.1, GCA_034144245.1, GCA_034144425.1, GCA_034144515.1, GCA_034145085.1, GCA_034145525.1, GCA_034146805.1, GCA_034146825.1, GCA_034149225.1, GCA_034149965.1, GCA_034150365.1, GCA_034152865.1, GCA_036776035.1, GCA_036801705.1, GCA_037239315.1, GCA_037247585.1, GCA_037253045.1, GCA_037265845.1, GCA_037298135.1, GCA_037317815.1, GCA_037319905.1, GCA_037323035.1, GCA_037337685.1, GCA_037338475.1, GCA_037341925.1, GCA_037347725.1, GCA_037430025.1, GCA_037435785.1, GCA_037437105.1, GCA_037454795.1, GCA_037456695.1, GCA_041326235.1, GCA_041330365.1, GCA_041331075.1, GCA_041334485.1, GCA_905205635.1, GCA_934667605.1, GCA_934667945.1, GCA_934699115.1, GCA_947071215.1, GCA_947645435.1, GCA_947645695.1, GCA_947647305.1, GCA_948907025.1, GCA_948937115.1, GCA_948947275.1, GCA_949014695.1, GCA_949015225.1, GCA_949024505.1, GCA_949030765.1, GCA_949042425.1, GCA_949052595.1, GCA_949052725.1, GCA_949053485.1, GCA_949091005.1, GCA_949417435.1, GCA_958349835.1, GCA_958426075.1, GCA_958434115.1, GCA_958435875.1, GCA_958437945.1, GCA_958442105.1, GCA_958442715.1, GCA_958444565.1, GCA_958448935.1, GCA_958450655.1, GCA_958455045.1, GCA_959020185.1, GCA_959021255.1, GCA_959025385.1, GCA_959605815.1, GCA_963586305.1, GCA_963928935.1, GCA_964239695.1, GCA_964241145.1, GCF_000154125.1, GCF_000157055.1, GCF_000162555.1, GCF_000178275.1, GCF_000218325.1, GCF_000273215.1, GCF_000699665.1, GCF_000699725.1, GCF_001314995.1, GCF_001535615.1, GCF_001578575.1, GCF_001815255.1, GCF_002959635.1, GCF_003363235.1, GCF_003435205.1, GCF_003439865.1, GCF_003458305.1, GCF_003458905.1, GCF_003459105.1, GCF_003459425.1, GCF_003463495.1, GCF_003465275.1, GCF_003465715.1, GCF_003465985.1, GCF_003466305.1, GCF_003468695.1, GCF_003470645.1, GCF_003472085.1, GCF_003472145.1, GCF_003472965.1, GCF_003604005.1, GCF_003612665.1, GCF_004167785.1, GCF_005844755.1, GCF_005844865.1, GCF_005844885.1, GCF_005844905.1, GCF_005844935.1, GCF_005844955.1, GCF_005844965.1, GCF_005845145.1, GCF_005845305.1, GCF_007012325.1, GCF_007341375.1, GCF_007341395.1, GCF_009734165.1, GCF_013361135.1, GCF_013361245.1, GCF_015547195.1, GCF_015547705.1, GCF_015548155.1, GCF_015548325.1, GCF_015548845.1, GCF_015549705.1, GCF_015549745.1, GCF_015550025.1, GCF_015550085.1, GCF_015550105.1, GCF_015551835.1, GCF_015552185.1, GCF_015552205.1, GCF_015552295.1, GCF_015554165.1, GCF_015554355.1, GCF_015554685.1, GCF_015555775.1, GCF_015555955.1, GCF_015556825.1, GCF_015557585.1, GCF_015557705.1, GCF_015557725.1, GCF_015558455.1, GCF_015558885.1, GCF_015559545.1, GCF_015561385.1, GCF_015670595.1, GCF_015831795.1, GCF_015831805.1, GCF_016894185.1, GCF_018292045.1, GCF_018368495.1, GCF_018377515.1, GCF_018492845.1, GCF_018785965.1, GCF_018785975.1, GCF_019126275.1, GCF_019128845.1, GCF_019128915.1, GCF_019129155.2, GCF_019129255.1, GCF_019129405.1, GCF_019129455.1, GCF_019412505.1, GCF_019412895.1, GCF_019418975.1, GCF_019424485.1, GCF_019733535.1, GCF_020091525.1, GCF_020149745.1, GCF_020256525.1, GCF_020256645.1, GCF_020256685.1, GCF_021406465.1, GCF_021406525.1, GCF_021409885.1, GCF_021410305.1, GCF_021410325.1, GCF_021410345.1, GCF_021410365.1, GCF_021410535.1, GCF_021410685.1, GCF_021410745.1, GCF_021411085.1, GCF_021411555.1, GCF_021411645.1, GCF_021411705.1, GCF_021589085.1, GCF_022713925.1, GCF_022716715.1, GCF_022740515.1, GCF_023668165.1, GCF_023668595.1, GCF_023668825.1, GCF_023668845.1, GCF_023668865.1, GCF_023668975.1, GCF_023669225.1, GCF_023669265.1, GCF_023669425.1, GCF_024759225.1, GCF_024759245.1, GCF_024759765.1, GCF_024759785.1, GCF_024787905.1, GCF_024788335.1, GCF_024788555.1, GCF_024788845.1, GCF_024789695.1, GCF_024791065.1, GCF_024791485.1, GCF_024792145.1, GCF_024793185.1, GCF_025146775.1, GCF_025914115.1, GCF_026966855.1, GCF_027257075.1, GCF_027660585.1, GCF_027661525.1, GCF_027661545.1, GCF_027661565.1, GCF_027661595.1, GCF_027668645.1, GCF_027669195.1, GCF_027681435.1, GCF_027681885.1, GCF_027681935.1, GCF_027682005.1, GCF_027683415.1, GCF_027688215.1, GCF_027690055.1, GCF_027692575.1, GCF_027693165.1, GCF_027694505.1, GCF_027694825.1, GCF_027717145.1, GCF_027722745.1, GCF_028399725.1, GCF_028399745.1, GCF_028399775.1, GCF_028399855.1, GCF_028399885.1, GCF_028399925.1, GCF_028399945.1, GCF_028399965.1, GCF_028399975.1, GCF_028400005.1, GCF_028400025.1, GCF_028400045.1, GCF_028400065.1, GCF_028400075.1, GCF_028400095.1, GCF_028400145.1, GCF_028400165.1, GCF_028400175.1, GCF_028400185.1, GCF_028400195.1, GCF_028400245.1, GCF_028400265.1, GCF_028400285.1, GCF_028400295.1, GCF_028400325.1, GCF_028400335.1, GCF_028400365.1, GCF_028400385.1, GCF_028400405.1, GCF_028400425.1, GCF_028400445.1, GCF_028400465.1, GCF_028400485.1, GCF_028400495.1, GCF_028400505.1, GCF_028400545.1, GCF_028400565.1, GCF_028400575.1, GCF_028400595.1, GCF_028400615.1, GCF_028400645.1, GCF_028400665.1, GCF_028400685.1, GCF_028400705.1, GCF_028400725.1, GCF_028400745.1, GCF_028400765.1, GCF_028400775.1, GCF_028400805.1, GCF_028400825.1, GCF_028400845.1, GCF_028400945.1, GCF_028400985.1, GCF_028400995.1, GCF_028401025.1, GCF_028401045.1, GCF_028401065.1, GCF_028401085.1, GCF_028401105.1, GCF_028401115.1, GCF_028401145.1, GCF_028401165.1, GCF_028401185.1, GCF_028401205.1, GCF_028401225.1, GCF_028401245.1, GCF_028401255.1, GCF_028401285.1, GCF_028401295.1, GCF_028401315.1, GCF_028401345.1, GCF_028401365.1, GCF_028402175.1, GCF_028402285.1, GCF_028402305.1, GCF_028402315.1, GCF_028402345.1, GCF_028402365.1, GCF_028402385.1, GCF_028402425.1, GCF_028528005.1, GCF_028561695.1, GCF_030168555.1, GCF_030928685.1, GCF_032144175.1, GCF_032476575.1, GCF_032490535.1, GCF_033099935.1, GCF_033550045.1, GCF_038561945.1, GCF_039064685.1, GCF_039064735.1, GCF_039064765.1, GCF_039064855.1, GCF_039733885.1, GCF_039755435.1, GCF_039755455.1, GCF_039755465.1, GCF_039755495.1, GCF_039755515.1, GCF_039755535.1, GCF_039755575.1, GCF_039755595.1, GCF_039755615.1, GCF_039755635.1, GCF_039755675.1, GCF_039761115.1, GCF_039761235.1, GCF_039761315.1, GCF_039761335.1, GCF_039761355.1, GCF_039761395.1, GCF_039761415.1, GCF_039761425.1, GCF_040091975.1, GCF_040092585.1, GCF_040092815.1, GCF_040095275.1, GCF_040097645.1, GCF_040227175.1, GCF_040227735.1, GCF_040227755.1, GCF_040227775.1, GCF_040227795.1, GCF_040227815.1, GCF_040227835.1, GCF_040227855.1, GCF_040227875.1, GCF_040227895.1, GCF_040227915.1, GCF_040227935.1, GCF_040227955.1, GCF_040227975.1, GCF_040227995.1, GCF_040913165.1, GCF_040913185.1, GCF_040913205.1, GCF_040913225.1, GCF_900095495.1, GCF_900107475.1, GCF_900445505.1, GCF_901212435.1, GCF_902374415.1, GCF_918258265.1, GCF_918270795.1, GCF_918271665.1, GCF_918277415.1, GCF_918279245.1, GCF_918291015.1, GCF_918291425.1, GCF_918291855.1, GCF_918297905.1, GCF_934699005.1, GCF_964237905.1, GCF_964238235.1, GCF_964238545.1, GCF_964239395.1, GCF_964239655.1, GCF_964239895.1, GCF_964239925.1, GCF_964240805.1, GCF_964241195.1, GCF_964243855.1, GCF_964244415.1, GCF_964246445.1, GCF_964260215.1, GCF_964260535.1	GCA_000273195.1_CDS_3360, GCA_000273195.1_CDS_3361, GCA_000273195.1_CDS_3368, GCA_000273195.1_CDS_3369, GCA_018366415.1_CDS_0564, GCA_024758065.1_CDS_6261, GCA_024788745.1_CDS_3011, GCA_024792605.1_CDS_3286	GCA_000273195.1_CDS_3359, GCA_000273195.1_CDS_3366, GCA_008679815.1_CDS_4234, GCA_019013265.1_CDS_3976, GCA_024792605.1_CDS_3277	persistent	0.6936758893280632	128	5664	0
